,number,value,datetime_start,datetime_complete,duration,params_L,params_N_D,params_W,params_coef,params_lr,params_sampling,system_attrs_completed_rung_0,system_attrs_completed_rung_1,system_attrs_completed_rung_2,system_attrs_completed_rung_3,system_attrs_completed_rung_4,system_attrs_completed_rung_5,system_attrs_completed_rung_6,system_attrs_completed_rung_7,state
0,0,10.778828897256021,2024-04-02 02:15:53.932620,2024-04-02 02:16:46.803698,0 days 00:00:52.871078,2,1601,64,0.8834748810462544,5.075585261226542e-05,random,20.68422244889306,20.68422244889306,20.68422244889306,20.68422244889306,20.68422244889306,20.68422244889306,19.486344555170714,12.85130842118054,COMPLETE
1,1,20.116698412747848,2024-04-02 02:16:46.805701,2024-04-02 02:16:56.469106,0 days 00:00:09.663405,2,490,64,0.3678897274923702,1.553062052873546e-05,random,20.439618552696086,20.439618552696086,20.439618552696086,20.439618552696086,20.439618552696086,20.439618552696086,20.116698412747848,,PRUNED
2,2,20.824338632701615,2024-04-02 02:16:56.470107,2024-04-02 02:17:01.096340,0 days 00:00:04.626233,2,248,64,0.11105992010595905,0.40176752596245285,random,20.824338632701615,,,,,,,,PRUNED
3,3,21.102432745574152,2024-04-02 02:17:01.097341,2024-04-02 02:17:14.899792,0 days 00:00:13.802451,8,2015,64,0.33691817027261844,0.032724201095840004,grid,21.102432745574152,,,,,,,,PRUNED
4,4,24.39884055145588,2024-04-02 02:17:14.900793,2024-04-02 02:18:39.273700,0 days 00:01:24.372907,4,1403,48,0.9253001500251904,0.07300021690770206,grid,24.398813624050995,24.398813624050995,24.398813624050995,24.398813624050995,24.398813624050995,24.39881224316069,25.050457515603195,,COMPLETE
5,5,22.2054450439463,2024-04-02 02:18:39.274702,2024-04-02 02:20:33.248056,0 days 00:01:53.973354,6,1661,32,0.8810224933834151,0.531223091713517,random,22.205457071824913,22.205457071824913,22.205457071824913,22.205457071824913,22.205457071824913,22.205457071824913,22.205458408259155,,COMPLETE
6,6,22.087396095064598,2024-04-02 02:20:33.249057,2024-04-02 02:20:47.123674,0 days 00:00:13.874617,8,66,64,0.9155837780617755,1.092918551755076e-05,grid,22.087396095064598,,,,,,,,PRUNED
7,7,4.372169653853128,2024-04-02 02:20:47.125675,2024-04-02 02:22:09.630722,0 days 00:01:22.505047,4,160,32,0.9207653607489436,0.00867636965528311,random,8.131339657868486,8.131339657868486,8.131339657868486,8.131339657868486,8.131339657868486,8.131339657868486,5.246584891004627,4.20929201906405,COMPLETE
8,8,21.37078589157002,2024-04-02 02:22:09.630722,2024-04-02 02:23:19.107522,0 days 00:01:09.476800,8,1009,64,0.6829250358692218,0.004446547062854878,random,4.0672657672856944,4.0672657672856944,4.0672657672856944,4.0672657672856944,4.0672657672856944,4.0672657672856944,2.2088521632729003,21.37078589157002,PRUNED
9,9,9.348607809038434,2024-04-02 02:23:19.108523,2024-04-02 02:23:30.938745,0 days 00:00:11.830222,6,216,32,0.7936026968253842,0.0034850154811532216,random,9.348607809038434,,,,,,,,PRUNED
10,10,8.535408120525005,2024-04-02 02:23:30.939746,2024-04-02 02:23:39.660274,0 days 00:00:08.720528,4,87,48,0.5995196603252393,0.00027735222847672834,grid,8.535408120525005,8.535408120525005,,,,,,,PRUNED
11,11,19.456041941468115,2024-04-02 02:23:39.661275,2024-04-02 02:23:44.955353,0 days 00:00:05.294078,2,598,32,0.7096421382503502,0.0002118852208785548,random,19.456041941468115,,,,,,,,PRUNED
12,12,3.8063173443714415,2024-04-02 02:23:44.956355,2024-04-02 02:25:10.283325,0 days 00:01:25.326970,4,147,48,0.4997884989707748,0.00029959223459148534,random,8.045339498186049,8.045339498186049,8.045339498186049,8.045339498186049,5.336206026239879,4.324795695696379,,,COMPLETE
13,13,14.19528361740793,2024-04-02 02:25:10.284326,2024-04-02 02:26:36.742847,0 days 00:01:26.458521,4,132,48,0.4803684431474986,0.0008155777371700077,random,6.5324328647938,4.55925599212996,14.046591146547675,,,,,,COMPLETE
14,14,15.343427209600895,2024-04-02 02:26:36.743848,2024-04-02 02:26:48.621101,0 days 00:00:11.877253,6,155,32,0.5024328514376097,0.014019565113834318,random,15.343427209600895,,,,,,,,PRUNED
15,15,8.652759449844199,2024-04-02 02:26:48.622103,2024-04-02 02:26:57.144834,0 days 00:00:08.522731,4,299,48,0.17735348466145456,0.0008916723541832921,random,8.652759449844199,8.652759449844199,,,,,,,PRUNED
16,16,5.155835394282236,2024-04-02 02:26:57.146835,2024-04-02 02:28:20.532554,0 days 00:01:23.385719,4,116,32,0.307982337100727,0.00011678691927386386,random,15.937163462888838,15.937163462888838,15.937163462888838,15.937163462888838,15.937163462888838,11.767089131520052,7.990163034323056,,COMPLETE
17,17,1.7517583708331148,2024-04-02 02:28:20.533555,2024-04-02 02:30:19.980509,0 days 00:01:59.446954,6,188,48,0.5687405008403559,0.0012069112931250075,random,7.212170148538276,7.212170148538276,7.212170148538276,7.212170148538276,7.212170148538276,5.282778988068047,3.951281755905985,,COMPLETE
18,18,7.1795246481105135,2024-04-02 02:30:19.982510,2024-04-02 02:30:32.141791,0 days 00:00:12.159281,6,396,48,0.5063716113394385,0.001002034311051025,grid,7.1795246481105135,7.1795246481105135,7.1795246481105135,,,,,,PRUNED
19,19,16.697578731814772,2024-04-02 02:30:32.142793,2024-04-02 02:30:43.970945,0 days 00:00:11.828152,6,205,48,0.5852526693576743,5.181856917693272e-05,random,16.697578731814772,,,,,,,,PRUNED
20,20,7.354651803670503,2024-04-02 02:30:43.971944,2024-04-02 02:30:55.992607,0 days 00:00:12.020663,6,83,48,0.21153689743869508,0.001282633312289653,random,7.354651803670503,7.354651803670503,,,,,,,PRUNED
21,21,3.5149082082659704,2024-04-02 02:30:55.993608,2024-04-02 02:31:13.125065,0 days 00:00:17.131457,4,171,48,0.7637656226225965,0.010704740260922052,random,3.5770339376949365,3.5770339376949365,3.5770339376949365,3.5770339376949365,3.5770339376949365,3.5770339376949365,3.5149082082659704,,PRUNED
22,22,7.162599674896503,2024-04-02 02:31:13.126066,2024-04-02 02:31:21.776610,0 days 00:00:08.650544,4,110,32,0.4467581592056934,0.00039789870063640983,random,7.162599674896503,7.162599674896503,7.162599674896503,,,,,,PRUNED
23,23,0.8995644253394373,2024-04-02 02:31:21.777611,2024-04-02 02:32:45.791983,0 days 00:01:24.014372,4,361,48,0.6040174540574869,0.005309057941622534,random,3.2032910755743593,3.2032910755743593,3.2032910755743593,3.2032910755743593,3.2032910755743593,3.2032910755743593,2.9589641595111837,1.1403588182231168,COMPLETE
24,24,3.1966689973666402,2024-04-02 02:32:45.792984,2024-04-02 02:33:09.919802,0 days 00:00:24.126818,6,343,48,0.5880414057390734,0.002598154764859697,random,2.8954697205245172,2.8954697205245172,2.8954697205245172,2.8954697205245172,2.8954697205245172,2.8954697205245172,3.1966689973666402,,PRUNED
25,25,20.970671984559704,2024-04-02 02:33:09.920804,2024-04-02 02:33:18.268965,0 days 00:00:08.348161,4,722,48,0.6067199578913702,0.05149895411337868,random,20.970671984559704,,,,,,,,PRUNED
26,26,0.5628689411976419,2024-04-02 02:33:18.269968,2024-04-02 02:34:11.465277,0 days 00:00:53.195309,2,273,48,0.42026197730284254,0.001993919423639078,grid,5.275612407626873,5.275612407626873,5.275612407626873,5.275612407626873,5.275612407626873,2.9461035319998383,1.4467620065036524,,COMPLETE
27,27,18.23141838286497,2024-04-02 02:34:11.467276,2024-04-02 02:34:16.586199,0 days 00:00:05.118923,2,281,48,0.3913084695027351,0.14677798885962107,grid,18.23141838286497,,,,,,,,PRUNED
28,28,1.8437049679731305,2024-04-02 02:34:16.587200,2024-04-02 02:34:42.927102,0 days 00:00:26.339902,2,385,48,0.674737663376467,0.022273941593439414,grid,2.288266669179769,2.288266669179769,2.288266669179769,2.288266669179769,2.288266669179769,2.288266669179769,1.4566831186444584,1.8437049679731305,PRUNED
29,29,4.896513843896959,2024-04-02 02:34:42.930108,2024-04-02 02:34:48.329886,0 days 00:00:05.399778,2,489,48,0.2921548313034074,0.002047955498377006,grid,4.896513843896959,4.896513843896959,,,,,,,PRUNED
30,30,0.20061905104195618,2024-04-02 02:34:48.331889,2024-04-02 02:35:40.843755,0 days 00:00:52.511866,2,214,64,0.41965640852795194,0.006118101321414105,grid,2.445097518160607,2.445097518160607,2.445097518160607,2.445097518160607,2.445097518160607,2.445097518160607,0.9515269473915492,0.49491847762779345,COMPLETE
31,31,0.13515671736507018,2024-04-02 02:35:40.845759,2024-04-02 02:36:33.639037,0 days 00:00:52.793278,2,201,64,0.4203059614426632,0.00586161365668336,grid,2.041907006484601,2.041907006484601,2.041907006484601,2.041907006484601,2.041907006484601,2.041907006484601,1.2285913592948265,0.34756552901130017,COMPLETE
32,32,0.1554726528453661,2024-04-02 02:36:33.641039,2024-04-02 02:37:23.041868,0 days 00:00:49.400829,2,240,64,0.4025184068674912,0.005755379893328038,grid,2.4239414354699993,2.4239414354699993,2.4239414354699993,2.4239414354699993,2.4239414354699993,2.4239414354699993,1.1944808109358205,0.2056622414783139,COMPLETE
33,33,2.5392003510243524,2024-04-02 02:37:23.042868,2024-04-02 02:37:27.644047,0 days 00:00:04.601179,2,255,64,0.4185658888329236,0.007652324442260356,grid,2.5392003510243524,2.5392003510243524,2.5392003510243524,,,,,,PRUNED
34,34,3.6138049508928103,2024-04-02 02:37:27.645049,2024-04-02 02:37:32.178165,0 days 00:00:04.533116,2,222,64,0.27675868279521565,0.0172116665345732,grid,3.6138049508928103,3.6138049508928103,,,,,,,PRUNED
35,35,0.38249375432759747,2024-04-02 02:37:32.179166,2024-04-02 02:38:17.823615,0 days 00:00:45.644449,2,483,64,0.3534019532852535,0.03470450921883584,grid,4.118907065837181,4.118907065837181,4.118907065837181,4.118907065837181,4.118907065837181,3.9533190712255326,1.3236616184230479,,COMPLETE
36,36,21.09355711769758,2024-04-02 02:38:17.824617,2024-04-02 02:38:23.031349,0 days 00:00:05.206732,2,484,64,0.3456585377057397,0.15223425154666828,grid,21.09355711769758,,,,,,,,PRUNED
37,37,21.202173505084858,2024-04-02 02:38:23.032348,2024-04-02 02:38:27.539681,0 days 00:00:04.507333,2,651,64,0.051107340047044314,0.955503337046955,grid,21.202173505084858,,,,,,,,PRUNED
38,38,0.5337966801384656,2024-04-02 02:38:27.539681,2024-04-02 02:39:18.257949,0 days 00:00:50.718268,2,829,64,0.24442951430948787,0.03325188957376098,grid,2.3297907577682255,2.3297907577682255,2.3297907577682255,2.3297907577682255,1.7398786752581112,0.36847839925005926,,,COMPLETE
39,39,21.077432224911636,2024-04-02 02:39:18.258949,2024-04-02 02:40:09.581741,0 days 00:00:51.322792,2,435,64,0.3805058813145113,0.1266868428500301,grid,21.077525878993278,,,,,,,,COMPLETE
40,40,9.311627698745413,2024-04-02 02:40:09.582742,2024-04-02 02:40:14.887466,0 days 00:00:05.304724,2,329,64,0.14786803013936178,0.0653252979221436,grid,9.311627698745413,,,,,,,,PRUNED
41,41,4.244893243127523,2024-04-02 02:40:14.889472,2024-04-02 02:40:25.536778,0 days 00:00:10.647306,2,1073,64,0.23917211045089953,0.033797341911832535,grid,4.063986698638265,4.063986698638265,4.063986698638265,4.063986698638265,4.063986698638265,4.244893243127523,,,PRUNED
42,42,1.2438469568931256,2024-04-02 02:40:25.537779,2024-04-02 02:41:18.164914,0 days 00:00:52.627135,2,972,64,0.3530031988508813,0.026004121454283723,grid,2.4008842165719817,2.4008842165719817,2.4008842165719817,2.4008842165719817,2.4008842165719817,2.4008842165719817,1.1277669844051392,0.34958237861170677,COMPLETE
43,43,2.9300285487874866,2024-04-02 02:41:18.166916,2024-04-02 02:41:23.277666,0 days 00:00:05.110750,2,778,64,0.26310989909107146,0.005917371310897032,grid,2.9300285487874866,2.9300285487874866,,,,,,,PRUNED
44,44,5.0672630003444485,2024-04-02 02:41:23.278667,2024-04-02 02:41:28.375366,0 days 00:00:05.096699,2,1272,64,0.329895992796443,0.04196163995389803,grid,5.0672630003444485,5.0672630003444485,,,,,,,PRUNED
45,45,21.05012314221029,2024-04-02 02:41:28.376365,2024-04-02 02:41:33.722040,0 days 00:00:05.345675,2,1969,64,0.4373065358733403,0.09362032648172047,grid,21.05012314221029,,,,,,,,PRUNED
46,46,2.561456382270636,2024-04-02 02:41:33.723041,2024-04-02 02:41:38.916972,0 days 00:00:05.193931,2,186,64,0.5372363178870367,0.014610634768900444,grid,2.561456382270636,2.561456382270636,2.561456382270636,,,,,,PRUNED
47,47,21.03591705120376,2024-04-02 02:41:38.917973,2024-04-02 02:41:44.472606,0 days 00:00:05.554633,2,579,64,0.46582727163877985,0.31920923626112047,grid,21.03591705120376,,,,,,,,PRUNED
48,48,0.1276204798138662,2024-04-02 02:41:44.473607,2024-04-02 02:42:36.450432,0 days 00:00:51.976825,2,837,64,0.3756767972240404,0.003591132391353276,grid,3.3628165827341903,3.3628165827341903,3.3628165827341903,3.3628165827341903,3.3628165827341903,1.6168458328925523,0.5204118260543827,,COMPLETE
49,49,4.017625840887448,2024-04-02 02:42:36.451431,2024-04-02 02:42:51.074355,0 days 00:00:14.622924,8,236,64,0.378685673974232,0.004366539614896214,grid,4.017625840887448,,,,,,,,PRUNED
