,number,value,datetime_start,datetime_complete,duration,params_L,params_N_D,params_W,params_coef,params_initialization,params_lr,system_attrs_completed_rung_0,system_attrs_completed_rung_1,system_attrs_completed_rung_2,system_attrs_completed_rung_3,system_attrs_completed_rung_4,system_attrs_completed_rung_5,system_attrs_completed_rung_6,system_attrs_completed_rung_7,system_attrs_completed_rung_8,state
93,93,34.26701754891733,2024-04-04 05:10:03.414685,2024-04-04 05:10:10.863454,0 days 00:00:07.448769,4,5632,96,0.46265655639691894,xavier,0.023155479133570387,34.26701754891733,,,,,,,,,PRUNED
94,94,17.794258723243505,2024-04-04 05:10:10.864457,2024-04-04 05:10:18.113707,0 days 00:00:07.249250,4,5120,96,0.3641692159047514,xavier,0.007077510841064477,17.794258723243505,17.794258723243505,17.794258723243505,17.794258723243505,17.794258723243505,,,,,PRUNED
95,95,49.62860416740129,2024-04-04 05:10:18.114708,2024-04-04 05:10:25.635542,0 days 00:00:07.520834,4,5632,96,0.1738590338797607,xavier,0.00022869880973963081,49.62860416740129,,,,,,,,,PRUNED
96,96,48.620486347964196,2024-04-04 05:10:25.636543,2024-04-04 05:10:34.328443,0 days 00:00:08.691900,6,1024,64,0.3429833519800656,kaiming,0.00010489697173031655,48.620486347964196,,,,,,,,,PRUNED
97,97,22.886990443733133,2024-04-04 05:10:34.330447,2024-04-04 05:10:40.488105,0 days 00:00:06.157658,2,4608,96,0.7173058549846192,eye,0.039057403355688365,22.886990443733133,,,,,,,,,PRUNED
98,98,34.782178400433416,2024-04-04 05:10:40.489106,2024-04-04 05:10:48.309195,0 days 00:00:07.820089,4,2048,128,0.5330671985097413,zeros,0.027536227206721525,34.782178400433416,,,,,,,,,PRUNED
99,99,49.59419739836872,2024-04-04 05:10:48.310196,2024-04-04 05:10:54.518839,0 days 00:00:06.208643,2,4096,128,0.4437364408713783,default,0.0019218223559388508,49.59419739836872,,,,,,,,,PRUNED
