,number,value,datetime_start,datetime_complete,duration,params_L,params_N_D,params_W,params_coef,params_initialization,params_lr,system_attrs_completed_rung_0,system_attrs_completed_rung_1,system_attrs_completed_rung_2,system_attrs_completed_rung_3,system_attrs_completed_rung_4,system_attrs_completed_rung_5,system_attrs_completed_rung_6,system_attrs_completed_rung_7,system_attrs_completed_rung_8,state
99,99,18.839235935251708,2024-04-04 06:00:37.110681,2024-04-04 06:00:45.445274,0 days 00:00:08.334593,4,3584,32,0.45689773642645576,kaiming,0.41771468843705734,18.839235935251708,,,,,,,,,PRUNED
